title,authors,year,journal,doi,uid,countries,abstract,citations,references,keywords,subtypeDescription,relevance_score
Navigating the future: machine learning's role in revolutionizing antimicrobial stewardship and infection prevention and control,"Hanna, John J.; Medford, Richard J.; LIPPINCOTT WILLIAMS & WILKINS; Hanna, John J.; Medford, Richard J.; Hanna, John J.; Medford, Richard J.; Medford, Richard J.; Hanna, John; Hanna, John",2024,CURRENT OPINION IN INFECTIOUS DISEASES,10.1097/QCO.0000000000001028,WOS:001256263800004,USA,"Purpose of reviewThis review examines the current state and future prospects of machine learning (ML) in infection prevention and control (IPC) and antimicrobial stewardship (ASP), highlighting its potential to transform healthcare practices by enhancing the precision, efficiency, and effectiveness of interventions against infections and antimicrobial resistance.Recent findingsML has shown promise in improving surveillance and detection of infections, predicting infection risk, and optimizing antimicrobial use through the development of predictive analytics, natural language processing, and personalized medicine approaches. However, challenges remain, including issues related to data quality, model interpretability, ethical considerations, and integration into clinical workflows.SummaryDespite these challenges, the future of ML in IPC and ASP is promising, with interdisciplinary collaboration identified as a key factor in overcoming existing barriers. ML's role in advancing personalized medicine, real-time disease monitoring, and effective IPC and ASP strategies signifies a pivotal shift towards safer, more efficient healthcare environments and improved patient care in the face of global antimicrobial resistance challenges.",0,0,antimicrobial stewardship; artificial intelligence; infection prevention and control; machine learning; COVID-19; MEDICINE,Review,2
Investigating classification supervised learning approaches for the identification of critical patients' posts in a healthcare social network,"Carnevale, Lorenzo; Celesti, Antonio; Fiumara, Giacomo; Galletta, Antonino; Villari, Massimo; ELSEVIER; Carnevale, Lorenzo; Celesti, Antonio; Fiumara, Giacomo; Galletta, Antonino; Villari, Massimo; Villari, Massimo; Celesti, Antonio; Galletta, Antonino; Carnevale, Lorenzo; Carnevale, Lorenzo; Fiumara, Giacomo; Galletta, Antonino; Fiumara, Giacomo",2020,APPLIED SOFT COMPUTING,10.1016/j.asoc.2020.106155,WOS:000529902300017,Italy,"Nowadays, Healthcare Social Networks (HSNs) offer the possibility to enhance patient care and education. However, they also present potential risks for patients due to the possible distribution of poor-quality or wrong information along with their bad interpretation. On one hand doctors and practitioners want to promote the exchange of information among patients about a specific disease, but on the other hand they do not have enough time to read patients' posts and moderate them when required. In this paper, we investigate and compare different supervised learning classifiers that we adopted for the classification of critical patients' posts who can trigger the intervention of the medical personnel. In particular, by considering different Bayesian, Linear and Support Vector Machine (SVM) classifiers we analyze their accuracy considering different n-grams datasets preparation approaches in order to identify the best approach for the identification of critical patients' posts in a Healthcare Social Network. (C) 2020 Elsevier B.V. All rights reserved.",12,0,Machine Learning; Natural language processing; Healthcare; Social network; Classification; Regression; USER SIMILARITY; MEDIA; PROFESSIONALS,Article,5
Patients Decision Aid System Based on FHIR Profiles,"Semenov, Ilia; Kopanitsa, Georgy; Denisov, Dmitry; Alexandr, Yakovenko; Osenev, Roman; Andreychuk, Yury; SPRINGER; Semenov, Ilia; Denisov, Dmitry; Osenev, Roman; Andreychuk, Yury; Kopanitsa, Georgy; Alexandr, Yakovenko; Kopanitsa, Georgy; Kopanitsa, Georgy",2018,JOURNAL OF MEDICAL SYSTEMS,10.1007/s10916-018-1016-4,WOS:000440484400001,Russia,"Patients are becoming more and more involved in clinical decision-making process. Several factors support this process. Advances in omics allows individualization of diagnosis and treatment. Patient awareness and easy availability of data on the Internet allows patients to become informed decision makers when it comes even to disease management. Mass media emphasize the issue of medical errors, making patients demanding for quality in medical care. In some healthcare settings, patents face a problem of interpreting medical data and making decisions on treatment tactics without having a doctor, who could potentially support them. Delegating this task to a Patient Decision Aide system can add automatically generated recommendations to result reports without adding significant workload on the doctors, increase patients' motivation and support their decisions. We have implemented a patient decision aid system based on the productions rules, which: Collects data from available sources; Automatically analyses and interprets laboratory test results; Recommends running additional tests for a more precise diagnostic; Delivers automatically generated reports to doctors and patients in a natural language. To achieve semantic interoperability with other systems we have implemented a FHIR engine. The knowledge base has been organized as a graph structure. The application is structured as a set of lightly coupled services, which implement the logic of the decision support system. In total, we have modelled 365 nodes of test components, 5084 nodes of inference rules, 49932 connections and 3072 blocks of text for medical certificates. The findings of the research provide a deep understanding of how the semantically interoperable clinical decision support systems are implemented. Advances in notification the patients with the elements of patient decision aid is important for clinical data management, and for patients' empowerment and protection. We suppose that the system empowering patients in such way can play a meaningful role in helping patients to make informed decisions during the process of diagnostics and treatment.",0,0,Medical informatics; telemedicine; expert system; methods of inference; case-based reasoning; medical standard; Decision support; Laboratory information system; Telemedicine; First order predicates; ELECTRONIC HEALTH RECORDS; SUPPORT-SYSTEM; PERSONALIZED MEDICINE; EMERGENCY-DEPARTMENT; LABORATORY TESTS; CLINICAL-TRIAL; IMPLEMENTATION; INFORMATION; MANAGEMENT; KNOWLEDGE,Article,0
Overall US Hospice Quality According to Decedent Caregivers-Natural Language Processing and Sentiment Analysis of 3389 Online Caregiver Reviews,"Hotchkiss, Jason; Ridderman, Emily; Buftin, William; SAGE PUBLICATIONS INC; Hotchkiss, Jason; Ridderman, Emily; Buftin, William; Hotchkiss, Jason; Hotchkiss, Jason; Hotchkiss, Dr. Jason; Ridderman, Emily",2024,AMERICAN JOURNAL OF HOSPICE & PALLIATIVE MEDICINE,10.1177/10499091231185593,WOS:001015468800001,USA,"Objectives: With an untapped quality resource in online hospice reviews, study aims were exploring hospice caregiver experiences and assessing their expectations of the hospice Medicare benefit. Methods: Topical and sentiment analysis was conducted using natural language processing (NLP) of Google and Yelp caregiver reviews (n = 3393) between 2013-2023 using Google NLP. Stratified sampling weighted by hospice size to approximate the daily census of US hospice enrollees. Results: Overall caregiver sentiment of hospice care was neutral (S = .14). Therapeutic, achievable expectations and misperceptions, unachievable expectations were, respectively, the most and least prevalent domains. Four topics with the highest prevalence, all had moderately positive sentiments: caring staff, staff professionalism and knowledge; emotional, spiritual, bereavement support; and responsive, timely or helpful. Lowest sentiments scores were lack of staffing; promises made, but not kept, pain, symptoms and medications; sped-up death, hasted, or sedated; and money, staff motivations. Significance of Results: Caregivers overall rating of hospice was neutral, largely due to moderate sentiment on achievable expectations in two-thirds of reviews mixed with unachievable expectations in one-sixth of reviews. Hospice caregivers were most likely to recommend hospices with caring staff, providing quality care, responsive to requests, and offering family support. Lack of staff, inadequate pain-symptom management were the two biggest barriers to hospice quality. All eight CAHPS measures were found in the discovered review topics. Close-ended CAHPS scores and open-ended online reviews have complementary insights. Future research should explore associations between CAHPS and review insights.",0,0,online caregiver reviews; hospice caregivers; google cloud NLP; hospice quality; CAHPS & REG; scores; consumer assessment of healthcare providers and systems; CARE; HOME,Article,2
Text Classification of Patient Experience Comments in Saudi Dialect Using Deep Learning Techniques,"Alhazzani, Najla Z.; Al-Turaiki, Isra M.; Alkhodair, Sarah A.; MDPI; Alhazzani, Najla Z.; Alkhodair, Sarah A.; Al-Turaiki, Isra M.; Al-Turaiki, Isra M.; Al-Turaiki, Isra; Alkhodair, Sarah; Alkhodair, Sarah A.; Al-Turaiki, Isra",2023,APPLIED SCIENCES-BASEL,10.3390/app131810305,WOS:001145086300001,Saudi Arabia,"Improving the quality of healthcare services is of the utmost importance in healthcare systems. Patient experience is a key aspect that should be gauged and monitored continuously. However, the measurement of such a vital indicator typically cannot be carried out directly, instead being derived from the opinions of patients who usually express their experience in free text. When it comes to patient comments written in the Arabic language, the currently used strategy to classify Arabic comments is totally reliant on human annotation, which is time-consuming and prone to subjectivity and error. Thus, fully using the value of patient feedback in a timely manner is difficult. This paper addresses the problem of classifying patient experience (PX) comments written in Arabic into 25 classes by using deep learning- and BERT-based models. A real-world data set of patient comments is obtained from the Saudi Ministry of Health for this purpose. Features are extracted from the data set, then used to train deep learning-based classifiers-including BiLSTM and BiGRU-for which pre-trained static word embedding and pre-training vector word embeddings are utilized. Furthermore, we utilize several Arabic pre-trained BERT models, in addition to building PX_BERT, a customized BERT model using the PX unlabeled database. From the experimental results for the 28 classifiers built in this study, the best-performing models (based on the F1 score) are found to be PX_BERT and AraBERTv02. To the best of our knowledge, this is the first study to tackle PX comment classification for the Arabic language.",0,0,text classification; multi-label classification; deep learning; natural language processing; NLP; word embeddings; Arabic; patient experience; PX; LSTM; GRU; BERT,Article,8
Health 4.0-how are we doing tomorrow?,"Mueschenich, Markus; Wamprecht, Laura; SPRINGER; Mueschenich, Markus; Wamprecht, Laura; Mueschenich, Markus",2018,BUNDESGESUNDHEITSBLATT-GESUNDHEITSFORSCHUNG-GESUNDHEITSSCHUTZ,10.1007/s00103-018-2702-6,WOS:000426098000013,Germany,"Digitization in healthcare is progressing steadily. While currently processes are being optimized and processes are being facilitated, the breakthrough of digital medicine is still forthcoming. Digital medicine includes applications that focus on the patient and give them the promise of better care. Many digital health applications are raising attention in traditional healthcare, as they are increasingly showing evidence.",0,0,Chatbots; Deep learning; Digital health; Health companion; Virtual reality; VIRTUAL-REALITY; CANCER; SYSTEM,Article,1
Application of Machine Learning and Word Embeddings in the Classification of Cancer Diagnosis Using Patient Anamnesis,"Ramos Magna, Andres Alejandro; Allende-Cid, Hector; Taramasco, Carla; Becerra, Carlos; Figueroa, Rosa L.; IEEE-INST ELECTRICAL ELECTRONICS ENGINEERS INC; Ramos Magna, Andres Alejandro; Allende-Cid, Hector; Taramasco, Carla; Becerra, Carlos; Figueroa, Rosa L.; Ramos Magna, Andres Alejandro; Figueroa, Rosa; Taramasco Toro, Carla; Taramasco, Carla; Figueroa, Rosa; Magna, Andres; Ramos Magna, Andres",2020,IEEE ACCESS,10.1109/ACCESS.2020.3000075,WOS:000544037000002,Chile,"Currently, one of the main challenges for information systems in healthcare is focused on support for health professionals regarding disease classifications. This work presents an innovative method for a recommendation system for the diagnosis of breast cancer using patient medical histories. In this proposal, techniques of natural language processing (NLP) were implemented on real datasets: one comprised 160, 560 medical histories of anonymous patients from a hospital in Chile for the following categories: breast cancer, cysts and nodules, other cancer, breast cancer surgeries and other diagnoses; and the other dataset was obtained from the MIMIC III dataset. With the application of word-embedding techniques, such as word2vec's skip-gram and BERT, and machine learning techniques, a recommendation system as a tool to support the physician's decision-making was implemented. The obtained results demonstrate that using word embeddings can define a good-quality recommendation system. The results of 20 experiments with 5-fold cross-validation for anamnesis written in Spanish yielded an F1 of 0.980 +/- 0.0014 on the classification of 'cancer' versus 'not cancer' and 0.986 +/- 0.0014 for 'breast cancer' versus 'other cancer'. Similar results were obtained with the MIMIC III dataset.",0,0,History; Medical diagnostic imaging; Breast cancer; Natural language processing; Natural language processing (NLP); machine learning; deep learning; recommendation system; anamnesis; BIDIRECTIONAL LSTM; ICD-9-CM,Article,6
Mining Domain Terminologies Using Search Engine's Query Log,"Ni, Weijian; Liu, Tong; Zeng, Qingtian; Xie, Nengfu; ASSOC COMPUTING MACHINERY; Ni, Weijian; Liu, Tong; Zeng, Qingtian; Xie, Nengfu; Liu, Tong; Zeng, Qingtian",2021,ACM TRANSACTIONS ON ASIAN AND LOW-RESOURCE LANGUAGE INFORMATION PROCESSING,10.1145/3462327,WOS:000721586800009,Peoples R China,"Domain terminologies are a basic resource for various natural language processing tasks. To automatically discover terminologies for a domain of interest, most traditional approaches mostly rely on a domain-specific corpus given in advance; thus, the performance of traditional approaches can only be guaranteed when collecting a high-quality domain-specific corpus, which requires extensive human involvement and domain expertise. In this article, we propose a novel approach that is capable of automatically mining domain terminologies using search engine's query log-a type of domain-independent corpus of higher availability, coverage, and timeliness than a manually collected domain-specific corpus. In particular, we represent query log as a heterogeneous network and formulate the task of mining domain terminology as transductive learning on the heterogeneous network. In the proposed approach, the manifold structure of domain-specificity inherent in query log is captured by using a novel network embedding algorithm and further exploited to reduce the need for the manual annotation efforts for domain terminology classification. We select Agriculture and Healthcare as the target domains and experiment using a real query log from a commercial search engine. Experimental results show that the proposed approach outperforms several state-of-the-art approaches.",0,0,Domain terminology; search engine; query log; network embedding; transductive learning; EXTRACTION; TERMS,Article,1
Indirect treatment comparison (ITC) of the efficacy of vutrisiran and tafamidis for hereditary transthyretin-mediated amyloidosis with polyneuropathy,"Merkel, Madeline; Danese, David; Chen, Chongshu; Wang, Jessie; Wu, Aozhou; Yang, Hongbo; Lin, Hollis; TAYLOR & FRANCIS LTD; Merkel, Madeline; Danese, David; Chen, Chongshu; Lin, Hollis; Wang, Jessie; Wu, Aozhou; Yang, Hongbo; Merkel, Madeline; Merkel, Madeline; Wu, Aozhou; Yang, Hongbo; Merkel, Madeline",2023,EXPERT OPINION ON PHARMACOTHERAPY,10.1080/14656566.2023.2215925,WOS:000995251500001,USA,"Plain Language SummaryHereditary transthyretin-mediated (ATTRv/hATTR) amyloidosis is a rare genetic disease that runs in families, affecting about 50,000 people worldwide. This condition results in abnormal protein deposits building up, causing damage to multiple nerves (polyneuropathy) and other organs, which can shorten lifespan and have other harmful effects. Polyneuropathy symptoms include weakness, numbness, pain, dizziness, and diarrhea. Over time, everyday activities become more difficult as patients become increasingly disabled and dependent on others. Several treatments have been approved for the polyneuropathy of ATTRv amyloidosis. Many of these work in different ways to impact the disease process. An indirect treatment comparison is a well-established statistical method used by healthcare decision-makers to compare treatments when head-to-head trials are unavailable. Indirect treatment comparisons using a common approach, the Bucher method, yield similar conclusions to head-to-head studies over 90% of the time. This method was used to compare clinical trial data for tafamidis and vutrisiran, two approved treatments for ATTRv amyloidosis with polyneuropathy. The findings show that vutrisiran is more effective than tafamidis at addressing the polyneuropathy of ATTRv amyloidosis as measured by changes to sensory or motor nervous system functioning and nutritional status. Also, vutrisiran showed greater maintenance of health-related quality of life compared to tafamidis. The expected benefits of vutrisiran over tafamidis are large enough to be noticeable and clinically meaningful to a patient or clinician. This highlights the potential advantages of vutrisiran compared to tafamidis with regard to preservation of physical function and quality of life when treating ATTRv amyloidosis with polyneuropathy.",0,0,familial amyloidosis; hereditary amyloidosis; indirect treatment comparison; patisiran; polyneuropathy; quality of life; tafamidis; vutrisiran; CARE DECISION-MAKING; NATURAL-HISTORY; TASK-FORCE; METAANALYSIS; PROGRESSION; SAFETY; SCORE,Article,0
Class Imbalance Handling with Deep Learning Enabled IoT Healthcare Diagnosis Model,"Ragupathi, T.; Govindarajan, M.; Priyaradhikadevi, T.; TECH SCIENCE PRESS; Ragupathi, T.; Govindarajan, M.; Priyaradhikadevi, T.; Ragupathi, T.; THAMODARAN, RAGUPATHI; Muthukumarasamy, Govindarajan",2022,INTELLIGENT AUTOMATION AND SOFT COMPUTING,10.32604/iasc.2022.025756,WOS:000806512400019,India,"The rapid advancements in the field of big data, wearables, Internet of Things (IoT), connected devices, and cloud environment find useful to improve the quality of healthcare services. Medical data classification using the data collected by the wearables and IoT devices can be used to determine the presence or absence of disease. The recently developed deep learning (DL) models can be used for several processes such as classification, natural language processing, etc. This study presents a bacterial foraging optimization (BFO) based convolutional neural network-gated recurrent unit (CNN-GRU) with class imbalance handling (CIH) model, named BFO-CNN-GRU-CIH for medical data classification in IoT enabled cloud environment. The proposed BFO-CNN-GRU-CIH model initially enables the IoT devices to gather healthcare data and preprocess it for further processing. In addition, Lempel Ziv Markov chain Algorithm (LZMA) is employed for the compression of healthcare data to reduce the amount of data being communicated. Besides, Synthetic Minority Over-sampling Technique (SMOTE) is applied to handle class imbalance data problems. Moreover, BFO with CNN-GRU model is utilized to perform the classification process in which the hyperparameters of the CNN-GRU model are optimally adjusted by the use of BFO algorithm. In order to showcase the better performance of the BFOCNN-GRU-CIH model, a wide range of simulations take place on three benchmark datasets and the results portrayed the betterment of the BFO-CNNGRU-CIH model over the recent state of art approaches.",0,0,IoT; cloud; healthcare; deep learning; parameter tuning; class imbalance handling; SYSTEM,Article,3
From single-case analysis of neonatal deaths toward a further reduction of the neonatal mortality rate,"Sander, Andre; Wauer, Roland; WALTER DE GRUYTER GMBH; Sander, Andre; Wauer, Roland; Sander, Andre",2019,JOURNAL OF PERINATAL MEDICINE,10.1515/jpm-2018-0003,WOS:000453780400018,Germany,"Background: The infant mortality rate (IMR), a key indicator of the quality of a healthcare system, has remained at approximately 3.5 parts per thousand for the past 10 years in Germany. Generic quality indicators (QIs), as used in Germany since 2010, greatly help in ensuring such a good value but do not seem to be able to further reduce the IMR. The neonatal mortality rate (NMR) contributes to 65-70% of the IMR. We therefore propose single-case analysis of neonatal deaths as an additional method and show an efficient way to implement this approach.",2,0,infant mortality rate; natural language processing; neonatal mortality; Nordic-Baltic classification; single-case analysis; QUALITY-ASSURANCE; TRANSPORTATION; PREDICTION; INFANTS; SCORE,Article,1
Neural-network based adaptive context prediction model for ambient intelligence,"Kim, Joo-Chang; Chung, Kyungyong; SPRINGER HEIDELBERG; Kim, Joo-Chang; Chung, Kyungyong; Chung, Kyungyong; Chung, Kyungyong; Joochang, Kim",2020,JOURNAL OF AMBIENT INTELLIGENCE AND HUMANIZED COMPUTING,10.1007/s12652-018-0972-3,WOS:000520835600011,South Korea,"To overcome the limitations of the conventional medical service in terms of ageing and chronic diseases, AmI-based precision medicine has drawn particular attention. Precision medicine is a customized personal medical service using various information technologies such as personal health device, AI algorithm, image recognition, voice recognition, and natural language processing. In particular, the information technologies for follow-up care services for patients, such as context awareness, context information, and inference rules, are required. In PHD, contexts such as variable data include blood pressure, BMI, blood sugar, weather, and food. It has time-series characteristics, meaning that it changes often with time. Other kinds of health-related information, such as age, family history, smoking, and residential area, are intermittently changed. For inference that is highly related to a user, the context collected through AmI is presented with ontology. Ontology consists of a user's ambient data, weather data, and lifelog. Context is changed along with a user's ambient conditions and time. An inference engine is used to create the knowledge base and predict a change. This study proposes a neural-network based adaptive context prediction model for ambient intelligence. This is a learning model using neural network to calculate the similarity for recommendation in a mining lifecare platform. In a conventional prediction procedure, an error is used to update a weight. The proposed model learns the similarity weight of the users to become adapted to the user's ambient. Based on the knowledge base, user clustering and deviation from mean are applied to calculate the similarity weight. Collaborative filtering technology is used to predict a user's context and learn the similarity weight repeatedly using a neural network. According to the performance evaluation, the proposed neural-network based similarity weight method had the highest accuracy of prediction when the learning rate was 0.001. Consequently, we found that AmI is a new added-value technology to maintain a healthy lifestyle and contributes to developing the healthcare industry and improving the quality of life.",2,0,Data mining; Neural network; Intelligence of Things; Context Computing; Ambient intelligence; SERVICE; SYSTEM,Article,3
