title,authors,year,journal,doi,uid,countries,abstract,citations,references,keywords,subtypeDescription,relevance_score
Hybrid deep architecture for intrusion detection in cyber-physical system: An optimization-based approach,"Arumugam, Sajeev Ram; Paul, P. Mano; Issac, Berin Jeba Jingle; Ananth, J. P.; WILEY; Arumugam, Sajeev Ram; Paul, P. Mano; Issac, Berin Jeba Jingle; Ananth, J. P.; Arumugam, Sajeev Ram; Paul P, Mano; John Patrick, Ananth; J P, Ananth; Arumugam, Sajeev Ram",2024,INTERNATIONAL JOURNAL OF ADAPTIVE CONTROL AND SIGNAL PROCESSING,10.1002/acs.3855,WOS:001253839700001,India,"Intrustion Detection System (IDS) refers to the gear or software that monitors a network or system for malicious activity or policy violations. Periodically, the system records any intrusion action or breach, which frequently modifies the administrator. Cyber Physical System (CPS) is particularly called as networked connected system, in which the system components are spatially distributed and integrated via the communication network. The control mechanism ensures computation significance; however, the system does affect attacks. Researchers are trying to handle this issue via the existing anomaly datasets. In this way, this paper follows an intrusion detection system under three major stages including extraction of features, selection of feature, and detection. The primary stage is the extraction of Statistical features like standard deviation, mean, mode, variance, and median, as well as higher-order statistical features like moment, percentile, improved correlation, kurtosis, mutual information, skewness, flow-based features, and information gain-based features. The curse of dimensionality becomes a significant problem in this scenario, so it is crucial to choose the right features. Improved Linear Discriminant Analysis (LDA) is utilized to choose the right features. The selected features are subjected to a Hybrid classifier for final detection. Here, models like CNN (Convolutional Neural Network) and Bi-GRU (Bidirectional Gated Recurrent Unit) are combined. A new Bernoulli Map Estimated Arithmetic Optimization Algorithm (BMEAOA) is added to train the system by adjusting the ideal weights of the two classifiers, leading to improved detection outcomes. Ultimately, the effectiveness is assessed in comparison to the other traditional techniques.",0,0,cyber physical system; hybrid classifier; intrusion detection; optimization; SECURITY; NETWORK; ATTACKS; PROTECTION; INTERNET; THINGS,Article,2
Promoting Pro-Environmental Behavior in Policymaking: A Text-Mining Approach for Literature Review,"Azad, Md. Abul Kalam; Ifti, Mehedi Hasan; Novera, Chowdhury Noushin; Huynh, Anh Ngoc Quang; Dongul, Esra Sipahi; SAGE PUBLICATIONS INC; Azad, Md. Abul Kalam; Ifti, Mehedi Hasan; Novera, Chowdhury Noushin; Huynh, Anh Ngoc Quang; Dongul, Esra Sipahi; Azad, Md. Abul Kalam; Azad, Md. Abul Kalam; Azad, Md. Abul Kalam; Sipahi Döngül, Esra; Sipahi Dongul, Esra; Azad, Abul",2024,EVALUATION REVIEW,10.1177/0193841X231176869,WOS:001001586800001,Bangladesh; Vietnam; Turkiye,"The impact of pro-environmental behavior on policymaking has been an exciting area of research. While the relationship between pro-environmental behavior and policymaking has been explored in numerous studies, there needs to be more synthesis on this topic. This is the first text-mining study of pro-environmental effects in which policymaking is a significant factor. In response, this study, for the first time, takes a novel approach by using text mining in R programming to analyze 30 publications from the Scopus database on pro-environmental behavior in policymaking, highlighting major research themes and prospective research areas for future investigation. Results from text mining yielded 10 topic models, which are presented with a synopsis of the published research and a list of the primary authors, as well as a posterior probability via latent Dirichlet allocation (LDA). Additionally, the study conducts a trend analysis of the top 10 journals with the highest impact factor, considering the influence of each journal's mean citation. The study offers an overview of the impacts of pro-environmental behavior in policymaking, showing the most relevant and frequently discussed themes, introduces the scientific visualization of papers published in the Scopus database, and proposes future study directions. These findings can help researchers and environmental specialists better understand how pro-environmental behavior can be fostered more effectively through policymaking.",0,0,pro-environmental behavior; review; text mining; policymaking; management; PUBLIC SUPPORT; MANAGEMENT; SPILLOVER; DETERMINANTS; CONSUMPTION; CONSUMERS,Review,4
Increased length-dependent activation of human engineered heart tissue after chronic ? <sub>1A</sub>-adrenergic agonist treatment: testing a novel heart failure therapy,"Rupert, C.; Lopez, J. E.; Cortez-Toledo, E.; Cabrera, O. De la Cruz; Chesler, N. C.; Simpson, P. C.; Campbell, S. G.; Baker, A. J.; AMER PHYSIOLOGICAL SOC; Rupert, C.; Lopez, J. E.; Cortez-Toledo, E.; Cabrera, O. De la Cruz; Chesler, N. C.; Chesler, N. C.; Simpson, P. C.; Baker, A. J.; Simpson, P. C.; Baker, A. J.; Campbell, S. G.; Baker, A. J.; Baker, A. J.; Rupert, Cassady; Lopez, Javier; Baker, Anthony",2023,AMERICAN JOURNAL OF PHYSIOLOGY-HEART AND CIRCULATORY PHYSIOLOGY,10.1152/ajpheart.00279.2022,WOS:000962556000004,USA,"Chronic stimulation of cardiac oc1A-adrenergic receptors (oc1A-ARs) improves symptoms in multiple preclinical models of heart failure. However, the translational significance remains unclear. Human engineered heart tissues (EHTs) provide a means of quantifying the effects of chronic oc1A-AR stimulation on human cardiomyocyte physiology. EHTs were created from thin slices of decellularized pig myocardium seeded with human induced pluripotent stem cell (iPSC)-derived cardiomyocytes and fibroblasts. With a paired experi-mental design, EHTs were cultured for 3 wk, mechanically tested, cultured again for 2 wk with oc1A-AR agonist A61603 (10 nM) or vehi-cle control, and retested after drug washout for 24 h. Separate control experiments determined the effects of EHT age (3-5 wk) or repeat mechanical testing. We found that chronic A61603 treatment caused a 25% increase of length-dependent activation (LDA) of contraction compared with vehicle treatment (n = 7/group, P = 0.035). EHT force was not increased after chronic A61603 treatment. However, after vehicle treatment, EHT force was increased by 35% relative to baseline testing (n = 7/group, P = 0.022), suggesting EHT maturation. Control experiments suggested that increased EHT force resulted from repeat mechanical testing, not from EHT aging. RNA-seq analysis confirmed that the oc1A-AR is expressed in human EHTs and found chronic A61603 treatment affected gene expression in biological pathways known to be activated by oc1A-ARs, including the MAP kinase signaling pathway. In conclusion, increased LDA in human EHT after chronic A61603 treatment raises the possibility that chronic stimulation of the oc1A-AR might be beneficial for increasing LDA in human myocardium and might be beneficial for treating human heart failure by restoring LDA.NEW & NOTEWORTHY Chronic stimulation of oc1A-adrenergic receptors (oc1A-ARs) is known to mediate therapeutic effects in animal heart failure models. To investigate the effects of chronic oc1A-AR stimulation in human cardiomyocytes, we tested engineered heart tissue (EHT) created with iPSC-derived cardiomyocytes. RNA-seq analysis confirmed human EHT expressed oc1A- ARs. Chronic (2 wk) oc1A-AR stimulation with A61603 (10 nM) increased length-dependent activation (LDA) of contraction. Chronic oc1A-AR stimulation might be beneficial for treating human heart failure by restoring LDA.",0,0,Adult; Affect; Apoptosis; Biological Assay; Blood capillaries; Cardiac; Cardiac Output; Cause of Death; Computer Models; Data; Data Set; Disease; Exposure to; Failure; Fibrosis; Functional disorder; Generations; Goals; Hand; Heart; Human; Human Rights; Hypertrophy; Impairment; Individual; Kinetics; Left; Measurement; Measures; Mechanics; Microfilaments; Mitochondria; Modeling; Morbidity - disease rate; Muscle Cells; Myocardial tissue; Myocardium; Nature; Necrosis; Organ; Organelles; Organism; Oxidative Stress; Patients; Phenotype; Protocols documentation; Public Health; Pulmonary artery structure; Rattus; Relaxation; Respiration; Right ventricular structure; Rodent; Rodent Model; Sampling; Severities; Techniques; Testing; Time; Tissues; Ventricular; Whole Organism; Work; cardiovascular collapse; constriction; coronary fibrosis; crosslink; effective therapy; exercise capacity; exercise intolerance; experience; experimental study; human disease; improved; in vivo; mortality; multi-scale modeling; novel; predictive modeling; preservation; pressure; prevent; pulmonary arterial hypertension; pulmonary vascular remodeling; right ventricular failure; oc 1A-adrenergic receptor; engineered heart tissue; heart failure; human; induced pluripotent stem cell; RIGHT-VENTRICULAR FAILURE; CONTRACTILITY; HYPERTROPHY; MATURATION; REVERSAL; SUBTYPE; CELLS,Article,1
Porosity prediction: Supervised-learning of thermal history for direct laser deposition,"Khanzadeh, Mojtaba; Chowdhury, Sudipta; Marufuzzaman, Mohammad; Tschopp, Mark A.; Bian, Linkan; ELSEVIER SCI LTD; Khanzadeh, Mojtaba; Chowdhury, Sudipta; Marufuzzaman, Mohammad; Bian, Linkan; Tschopp, Mark A.; Bian, Linkan; Bian, Linkan; Bian, Linkan; Khanzadeh, Mojtaba; Tschopp, Mark",2018,JOURNAL OF MANUFACTURING SYSTEMS,10.1016/j.jmsy.2018.04.001,WOS:000435061400006,USA,"The objective of this study is to investigate the relationship between the melt pool characteristics and the defect occurrence in an as-built additive manufacturing part. One of the major detrimental microstructure properties associated with additive manufacturing (AM) is porosity within final parts. State-of-the-art porosity detection methods focus primarily on post-manufacturing approaches that are susceptible to high cost of process, longer process time, and are incapable of characterizing pores during fabrication. A real-time porosity prediction method is developed using morphological characteristics of the melt pool boundary (i.e., features obtained via functional principal component analysis (FPCA)). A thermal monitoring system is used to capture the time varying melt pool signal, which are labeled as either pores or normal melt pools by X-ray tomography. Supervised learning methods are utilized to identify the patterns of melt pool images and build a black-box model for the probability distribution of class labels (namely, porosity) based on data characteristics of predictors (e.g., melt pool characteristics). The resultant model does not depend on specific design of specimens with varying material properties; and can be effectively developed as long as thermal-porosity data can be obtained. In the current study, multiple supervised machine learning approaches are used to classify melt pools to predict porosity in a part. Two different accuracy measures are used and numerical experiments show that among the classification approaches used (i.e., Decision Tree (DT), K-Nearest Neighbor (KNN), Support Vector Machine (SVM), Linear Discriminant Analysis (LDA), and Quadratic Discriminant Analysis (QDA)), KNN results in the highest rate of accurately classifying melt pools (98.44%). However, DT results in the lowest rate for incorrectly identifying normal melt pools as pores (0.03%). A comparative study is conducted that compares the performance of supervised learning methods leveraging the proposed morphological model and simple metrics of the melt pool. Numerical experiments show that the morphological model combined with supervised learning techniques vastly outperform the simple melt pool metrics combined with supervised learning techniques (approximately 250% better performance for correctly predicting abnormal melt pools). Our approach may potentially be applied to other AM processes that share similar energy-material interactions (e.g., powder bed fusion, electron beam melting).",8,0,Additive manufacturing; Supervised learning; Thermal history; Porosity prediction; SUPPORT VECTOR MACHINES; DECISION TREE CLASSIFICATION; RAY COMPUTED-TOMOGRAPHY; NEURAL NETWORKS; FACE DETECTION; WATER-CONTENT; POOL; TEMPERATURE; TRANSFORM; MECHANISM,Article,5
Effects of cadmium contamination on bacterial and fungal communities in <i>Panax ginseng</i>-growing soil,"Sun, Hai; Shao, Cai; Jin, Qiao; Li, Meijia; Zhang, Zhenghai; Liang, Hao; Lei, Huixia; Qian, Jiaqi; Zhang, Yayu; BMC; Sun, Hai; Shao, Cai; Jin, Qiao; Li, Meijia; Zhang, Zhenghai; Liang, Hao; Lei, Huixia; Qian, Jiaqi; Zhang, Yayu; Sun, Hai; Shao, Cai; Jin, Qiao; Li, Meijia; Zhang, Zhenghai; Lei, Huixia; Qian, Jiaqi; Zhang, Yayu; Liang, Hao; Zhang, Yayu; Zhang, Yayu; Zhang, Yayu; Zhang, Yayu; qian, jiaqi",2022,BMC MICROBIOLOGY,10.1186/s12866-022-02488-z,WOS:000770757400001,Peoples R China,"Background Cadmium (Cd) contamination in soil poses a serious safety risk for the development of medicine and food with ginseng as the raw material. Microorganisms are key players in the functioning and service of soil ecosystems, but the effects of Cd-contaminated ginseng growth on these microorganisms is still poorly understood. To study this hypothesis, we evaluated the effects of microorganisms and Cd (0, 0.25, 0.5, 1.0, 2.0, 5.0, and 10.0 mg kg(-1) of Cd) exposure on the soil microbial community using Illumina HiSeq high-throughput sequencing. Results Our results indicated that Cd-contaminated soil affected the soil microbial diversity and composition, and bacterial diversity was affected more than fungal diversity in Cd-contaminated soil, especially according to Shannon indices. The abundance of the soil microbial community decreased and the composition changed according to the relative abundances at the phylum level, including those of Saccharibacteria and Gemmatimonadetes in bacteria and Mortierellomycota in fungi. The LEfSe algorithm was used to identify active biomarkers, and 45 differentially abundant bacterial taxonomic clades and 16 differentially abundant fungal taxonomic clades were identified with LDA scores higher than 4.0. Finally, a heatmap of Spearman's rank correlation coefficients and canonical discriminant analysis (CDA) indicated that some key biomarkers, Arenimonas, Xanthomonadales, Nitrosomonadaceae, Methylophilales, Caulobacterales, Aeromicrobium, Chitinophagaceae, Acidimicrobiales, Nocardioidaceae, Propionibacteriales, Frankiales, and Gemmatimonadaceae, were positively correlated with the total and available Cd (p<0.05) but negatively correlated with AK, AP, and pH (p<0.05) in the bacterial community. Similarly, in the fungal community, Tubaria, Mortierellaceae, and Rhizophagus were positively correlated with the total and available Cd but negatively correlated with AK, AP, TK, and pH. Conclusion Cd contamination significantly affected microbial diversity and composition in ginseng-growing soil. Our findings provide new insight into the effects of Cd contamination on the microbial communities in ginseng-growing soil.",0,0,Panax ginseng; Cadmium contamination; Microbial community; HiSeq sequencing; HEAVY-METAL POLLUTION; LONG-TERM; MICROBIAL ACTIVITY; GROUPS DIFFER; BIOAVAILABILITY; PLANTS; CHINA,Article,1
Mapping knowledge landscapes and emerging trends of Marburg virus: A text-mining study,"Lyu, Yuanjun; Li, Wanqing; Guo, Qiang; Wu, Haiyang; CELL PRESS; Lyu, Yuanjun; Li, Wanqing; Guo, Qiang; Wu, Haiyang; Wu, Haiyang; Wu, Haiyang",2024,HELIYON,10.1016/j.heliyon.2024.e29691,WOS:001230297700001,Peoples R China,"Background: Marburg virus (MARV), a close relative of Ebola virus, could induce hemorrhagic fevers in humans with high mortality rate. In recent years, increasing attention has been paid to this highly lethal virus due to sporadic outbreaks observed in various African nations. This bibliometric analysis endeavors to elucidate the trends, dynamics, and focal points of knowledge that have delineated the landscape of research concerning MARV. Methods: Relevant literature on MARV from 1968 to 2023 was extracted from the Web of Science Core Collection database. Following this, the data underwent bibliometric analysis and visualization procedures utilizing online analysis platform, CiteSpace 6.2R6, and VOSviewer 1.6.20. Three different types of bibliometric indicators including quantitative indicator, qualitative indicators, and structural indicators were used to gauge a researcher's productivity, assess the quality of their work, and analyze publication relationships, respectively. Results: MARV is mainly prevalent in Africa. And approximately 643 confirmed cases have been described in the literature to date, and mortality observed was 81.2 % in overall patients. A total of 1014 papers comprising 869 articles and 145 reviews were included. The annual publications showed an increasing growth pattern from 1968 to 2023 (R2 = 0.8838). The United States stands at the forefront of this discipline, having dedicated substantial financial and human resources to scientific inquiry. However, co-authorship analysis showed the international research collaboration needs to be further strengthened. Based on reference and keywords analysis, contemporary MARV research encompasses pivotal areas: primarily, prioritizing the creation of prophylactic vaccines to impede viral spread, and secondarily, exploring targeted antiviral strategies, including small-molecule antivirals or MARV-specific monoclonal antibodies. Additionally, a comprehensive grasp of viral transmission, transcription, and replication mechanisms remains a central focus in ongoing investigations. And future MARV studies are expected to focus on evaluating clinical trial safety and efficacy, developing inhibitors to contain viral spread, exploring vaccine immunogenicity, virus-host association studies, and elucidating the role of neutralizing antibodies in MARV treatment. Conclusion: The present study offered comprehensive insights into the contemporary status and trajectories of MARV over the past decades. This enables researchers to discern novel",1,0,Marburg virus; Infectious diseases; Bibliometric; VOSviewer; CiteSpace; PROTECTS NONHUMAN-PRIMATES; EBOLA-VIRUS; HEMORRHAGIC-FEVER; VACCINE; SCIENCE; TRANSCRIPTION; INHIBITORS; MONKEYPOX; GHANA,Article,0
Data Processing and Text Mining Technologies on Electronic Medical Records: A Review,"Sun, Wencheng; Cai, Zhiping; Li, Yangyang; Liu, Fang; Fang, Shengqun; Wang, Guoyan; HINDAWI LTD; Sun, Wencheng; Cai, Zhiping; Fang, Shengqun; Li, Yangyang; Liu, Fang; Wang, Guoyan; Cai, Zhiping; Cai, Zhiping; Cai, Zhiping",2018,JOURNAL OF HEALTHCARE ENGINEERING,10.1155/2018/4302425,WOS:000430670100001,Peoples R China,"Currently, medical institutes generally use EMR to record patient's condition, including diagnostic information, procedures performed, and treatment results. EMR has been recognized as a valuable resource for large-scale analysis. However, EMR has the characteristics of diversity, incompleteness, redundancy, and privacy, which make it difficult to carry out data mining and analysis directly. Therefore, it is necessary to preprocess the source data in order to improve data quality and improve the data mining results. Different types of data require different processing technologies. Most structured data commonly needs classic preprocessing technologies, including data cleansing, data integration, data transformation, and data reduction. For semistructured or unstructured data, such as medical text, containing more health information, it requires more complex and challenging processing methods. The task of information extraction for medical texts mainly includes NER (named-entity recognition) and RE (relation extraction). This paper focuses on the process of EMR processing and emphatically analyzes the key techniques. In addition, we make an in-depth study on the applications developed based on text mining together with the open challenges and research issues for future work.",21,0,EXTRACTION; INFORMATION; ASSERTIONS; SYSTEM; RULE,Review,5
The effects of violence and related stress on asthma,"Han, Yueh-Ying; Celedo, Juan C.; Celedo, Juan C.; ELSEVIER SCIENCE INC; Celedo, Juan C.; Celedo, Juan C.; Celedo, Juan C.; Celedon, Juan C.",2024,ANNALS OF ALLERGY ASTHMA & IMMUNOLOGY,10.1016/j.anai.2024.07.023,WOS:001372217900001,USA,"In the United States, people living in deprived urban areas and persons in certain minoritized groups are often exposed to violence and affected with asthma, and epidemiologic studies have shown a link between exposure to violence (ETV) and asthma throughout the lifespan. Indeed, ETV at the individual, intrafamilial and community levels has been linked to asthma in children and adults. In this review, we discuss the evidence for a causal relation between ETV and asthma, emphasizing findings published in the last five years. Interpretation of the available evidence is limited by variable quality of the assessment of ETV or asthma, potential recall and selection bias, inability to estimate the relative contribution of various types of violence to the observed associations, lack of objective biomarkers of asthma or asthma endotypes, and inconsistent consideration of potential confounders or modifiers of the ETV-asthma link. Despite such limitations, the aggregate evidence from studies conducted in different locations and populations suggests that ETV affects asthma and asthma outcomes, and that this is explained by direct physiologic effects of violence-related distress and indirect effects (e.g., through risky health behaviors or co-morbidities). Thus, large prospective studies with careful assessment of specific types of ETV, key covariates and comorbidities (including mental illness), and asthma are needed to advance this field. Such research efforts should not preclude screening for maltreatment in children with asthma and ETV-related depression and anxiety in adolescents and adults with asthma. Further, vigorous policies are needed to curtail violence, as such policies could benefit patients with asthma while saving lives. (c) 2024 American College of Allergy, Asthma & Immunology. Published by Elsevier Inc. All rights are reserved, including those for text and data mining, AI training, and similar technologies.",0,0,INTIMATE PARTNER VIOLENCE; ADVERSE CHILDHOOD EXPERIENCES; HEALTH-RISK BEHAVIORS; HIGH-SCHOOL-STUDENTS; COMMUNITY VIOLENCE; PHYSICAL HEALTH; SEX-DIFFERENCES; BRONCHODILATOR RESPONSE; POSTTRAUMATIC STRESS; NEIGHBORHOOD SAFETY,Article,1
