title,authors,year,journal,doi,uid,countries,abstract,citations,references,keywords,subtypeDescription,relevance_score
Online dental trauma course for medical education,"Yeng, Thai; O'Sullivan, Anthony J.; Shulruf, Boaz; WILEY; Yeng, Thai; Shulruf, Boaz; O'Sullivan, Anthony J.; Yeng, Thai; Shulruf, Boaz; Yeng, Aik Thai; Yeng, Dr. Thai",2021,DENTAL TRAUMATOLOGY,10.1111/edt.12696,WOS:000663601500001,Australia,"A literature review identified a knowledge deficit among medical doctors about dental trauma management. To overcome this knowledge gap, a proposal to integrate dental traumatology teaching into the medical curriculum was made to raise medical students' awareness of, and familiarity with managing dental injuries. Despite the challenges of teaching dental trauma, online courses are viewed as a practical learning approach for students to access course material during their busy university schedules. In focusing on the constructivist model, this article details the design and development of the online dental trauma course. It is an example of a learner-led, fully online course. The six steps involved in the course development were as follows: (1) structured order from preclinical to clinical topics; (2) content covering all essential information on TDI diagnosis and management; (3) illustrative materials to support engagement and motivation to complete the course; (4) feedback processes to evaluate the learning process; (5) interactions between peers, educators, and learning materials to help facilitate learning; and (6) content that encompasses mainly visual learning styles. The online dental trauma course has the potential to make important contributions to medical education.",0,0,dental education; dental trauma; learning theories; medical education; online learning; MANAGEMENT; PHYSICIANS; KNOWLEDGE; INJURIES; OUTCOMES,Review,0
What ails physician review websites? A study of information needs of patients,"Ghosh, Soham; Chakraborty, Soumyakanti; Gupta, Narain; Basu, Sumanta; ELSEVIER; Ghosh, Soham; Chakraborty, Soumyakanti; Basu, Sumanta; Gupta, Narain; Ghosh, Soham; Ghosh, Soham; Ghosh, Soham; Basu, Sumanta; Ghosh, Soham; Ghosh, Soham; Basu, Sumanta",2023,DECISION SUPPORT SYSTEMS,10.1016/j.dss.2022.113897,WOS:000927616700001,India,"Physician Review Websites (PRWs) help users select physicians by providing both structured and unstructured data on physicians and patients' experiences with physicians. In this paper, the adequacy of the available in-formation on PRWs is investigated. An empirical study is conducted to understand the information that patients seek from PRWs through a survey instrument administered to 344 patients. A topic modelling approach is then employed on 666,551 text reviews of patients using data from a popular PRW in India to discover information available on the PRWs. Combining both approaches, it is found that 12 out of 25 topics are either unavailable or only partially available, indicating an information gap. Two topics which constitute the information gap are then utilised to conduct a full factorial experiment on 153 respondents using a Latin Square design. Experimental results demonstrate that adding relevant information improves the physician selection process. Our work con-tributes to the healthcare IS literature on online physician selection and the role of information availability. The results will help PRWs and hospitals decide how to restructure information on their websites and devise stra-tegies to nudge patients to write reviews highlighting the desired information.",0,0,Physician review websites (PRWs); Healthcare analytics; Topic modelling; Online reviews; Patient experience; Experimental design; CONSUMERS DECISION-MAKING; PRODUCT REVIEWS; HEALTH-CARE; ONLINE; PERCEPTIONS; OVERLOAD; SCALE; TRUST,Review,2
Intraperitoneal local anaesthetic instillation versus no intraperitoneal local anaesthetic instillation for laparoscopic cholecystectomy,"Rutherford, Duncan; Massie, Eleanor M.; Worsley, Calum; Wilson, Michael S. J.; WILEY; Rutherford, Duncan; Worsley, Calum; Massie, Eleanor M.; Wilson, Michael S. J.; Rutherford, Duncan",2021,COCHRANE DATABASE OF SYSTEMATIC REVIEWS,10.1002/14651858.CD007337.pub4,WOS:000714433300039,Scotland,"Background Pain is one of the important reasons for delayed discharge after laparoscopic cholecystectomy. Use of intraperitoneal local anaesthetic for laparoscopic cholecystectomy may be a way of reducing pain. A previous version of this Cochrane Review found very low-certainty evidence on the benefits and harms of the intervention. Objectives To assess the benefits and harms of intraperitoneal instillation of local anaesthetic agents in people undergoing laparoscopic cholecystectomy. Search methods We searched the Cochrane Hepato-Biliary Group Controlled Trials Register, Cochrane Central Register of Controlled Trials, MEDLIN E, Embase, and three other databases to 19 January 2021 together with reference checking of studies retrieved. We also searched five online clinical trials registries to identify unpublished or ongoing trials to 10 Septem ber 2021. We contacted study authors to identify additional studies. Selection criteria We only considered randomised clinical trials (irrespective of language, blinding, publication status, or relevance of outcome measure) comparing local anaesthetic intraperitoneal instillation versus placebo, no intervention, or inactive control during laparoscopic cholecystectomy, for the review. We excluded non -randomised studies, and studies where the method of allocating participants to a treatment was not strictly random (e.g. date of birth, hospital record number, or alternation). Data collection and analysis Two review authors collected the data independently. Primary outcomes included all -cause mortality, serious adverse events, and quality of life. Secondary outcomes included length of stay, pain, return to activity and work, and non -serious adverse events. The analysis included both fixed -effect and random -effects models using RevManWeb. We performed subgroup, sensitivity, and meta -regression analyses. For each outcome, we calculated the risk ratio (RR) or mean difference (MD) with 95% confidence intervals (Cls). We assessed risk of bias using predefined domains, graded the certainty of the evidence using GRADE, and presented outcome results in a summary of findings table. Main results Eighty-five completed trials were included, of which 76 trials contributed data to one or more of the outcomes. This included a total of 4957 participants randomised to intraperitoneal local anaesthetic instillation (2803 participants) and control (2154 participants). Most trials only included participants undergoing elective la paroscopic cholecystectomy and those who were at low anaesthetic risk (ASA I and II). The most commonly used local anaesthetic agent was bupivacaine. Methods of instilling the local anaesthetic varied considerably between trials; this included location and timing of application. The control groups received 0.9% normal saline (69 trials), no intervention (six trials), or sterile water (two trials). One trial did not specify the control agent used. None of the trials provided information on follow-up beyond point of discharge from hospital. Only two trials were at low risk of bias. Seven trials received external funding, of these three were assessed to be at risk of conflicts of interest, a further 17 trials declared no funding. We are very uncertain about the effect intraperitoneal local anaesthetic versus control on mortality; zero mortalities in either group (8 trials; 446 participants; very low -certainty evidence); serious adverse events (RR 1.07; 95% CI 0.49 to 2.34); 13 trials; 988 participants; discharge on same day of surgery (RR 1.43; 95% CI 0.64 to 3.",0,0,Ambulatory Surgical Procedures [statistics & numerical data]; Anesthesia; Local [methods]; Anesthetics; Local radministration &; dosage]; Bupivacaine [administration & dosage]; Cholecystectomy; Laparoscopic [ adverse effects] [methods]; Gallstones [surgery]; Length of Stay [statistics & numerical data]; Randomized Controlled Trials as Topic; Humans; POSTOPERATIVE PAIN RELIEF; TRIAL SEQUENTIAL-ANALYSIS; COMBINED PREINCISIONAL INFILTRATION; RANDOMIZED CONTROLLED-TRIALS; DOUBLE-BLIND; ROPIVACAINE INSTILLATION; PREEMPTIVE ANALGESIA; GALLBLADDER BED; BUPIVACAINE INSTILLATION; DESIGN CHARACTERISTICS,Review,0
"Supporting migrants and refugees with posttraumatic stress disorder: development, pilot implementation, and pilot evaluation of a continuing interprofessional education for healthcare providers","Jobst, Stefan; Windeisen, Matthias; Wuensch, Alexander; Meng, Michael; Kugler, Christiane; BMC; Jobst, Stefan; Windeisen, Matthias; Meng, Michael; Kugler, Christiane; Wuensch, Alexander; Kugler, Christiane; Jobst, Stefan; Wunsch, Alexander; Meng, Michael",2020,BMC MEDICAL EDUCATION,10.1186/s12909-020-02220-3,WOS:000573067000001,Germany,"Background Refugees and migrants face an increased risk of developing posttraumatic stress disorder (PTSD). Adequate care can be insufficient due to language barriers, cultural differences, and knowledge deficits of health service providers. Therefore, professional associations requested that healthcare providers to be educated to provide culturally sensitive care. An evidence-based educational intervention in the form of a continuing interprofessional education (CIPE) for healthcare providers on the topic of PTSD in migrants and refugees was developed, pilot-implemented, and evaluated according to the first two levels of the Kirkpatrick evaluation model (reaction and learning). Methods The development of a curriculum for the CIPE intervention was based on a narrative literature review. Its content was validated by experts (N = 17) in an online survey and analyzed using both the Content Validity Index and a thematic analysis. The evaluation of the CIPE intervention was performed by conducting a pilot study with a quasi-experimental single group, using a pre-posttest design. In total, there were 39 participants distributed among three pilot courses. We collected and analyzed data on satisfaction, knowledge, and feasibility. Results The curriculum for a half-day course, consisting of 8 modules, showed almost excellent content validity (S-CVI = 0.92). In the pilot-implementation phase, participants were ""very satisfied"" with the pilot courses and a positive effect on their knowledge was detected. No correlation between satisfaction and knowledge gain was found. Conclusions The CIPE intervention can be considered feasible and seems promising in its effects on satisfaction and knowledge. The insights gained in this study can be used to adapt and optimize the educational intervention, whereby the feedback from course attendees is particularly useful. Future studies need to further examine the effects in larger samples and more robust study designs.",0,0,Posttraumatic stress disorder; Migration; Refugee; Interprofessional continuing education; Healthcare; Pilot study; Kirkpatrick model; Satisfaction; Knowledge; TRAUMA-RELATED DISORDERS; ASYLUM SEEKERS; KNOWLEDGE,Article,0
Innovating health prevention models in detecting infectious disease outbreaks through social media data: an umbrella review of the evidence,"Giancotti, Monica; Lopreite, Milena; Mauro, Marianna; Puliga, Michelangelo; FRONTIERS MEDIA SA; Giancotti, Monica; Lopreite, Milena; Mauro, Marianna; Puliga, Michelangelo; Giancotti, Monica; LOPREITE, Milena; puliga, michelangelo; Mauro, Marianna",2024,FRONTIERS IN PUBLIC HEALTH,10.3389/fpubh.2024.1435724,WOS:001371609700001,Italy,"Introduction and objective: The number of literature reviews examining the use of social media in detecting emerging infectious diseases has recently experienced an unprecedented growth. Yet, a higher-level integration of the evidence is still lacking. This study aimed to synthesize existing systematic literature reviews published on this topic, offering an overview that can help policymakers and public health authorities to select appropriate policies and guidelines. Methods: We conducted an umbrella review: a review of systematic reviews published between 2011 and 2023 following the PRISMA statement guidelines. The review protocol was registered in the PROSPERO database (CRD42021254568). As part of the search strategy, three database searches were conducted, specifically in PubMed, Web of Science, and Google Scholar. The quality of the included reviews was determined using A Measurement Tool to Assess Systematic Reviews 2. Results: Synthesis included 32 systematic reviews and 3,704 primary studies that investigated how the social media listening could improve the healthcare system's efficiency in terms of a timely response to treat epidemic situations. Most of the included systematic reviews concluded showing positive outcomes when using social media data for infectious disease surveillance. Conclusion: Systematic reviews showed the important role of social media in predicting and detecting disease outbreaks, potentially reducing morbidity and mortality through swift public health action. The policy interventions strongly benefit from the continued use of online data in public health surveillance systems because they can help in recognizing important patterns for disease surveillance and significantly improve the disease prediction abilities of the traditional surveillance systems.",0,0,health policy; emerging infectious diseases; umbrella review; social media; surveillance; SYSTEMATIC REVIEWS; SURVEILLANCE; TWITTER,Review,0
An Exploration of Nurses' Experience Following a Face-to-Face or Web-Based Intervention on Patient Deterioration,"Kim, Jeong-Ah; Jones, Linda K.; Terry, Daniel; Connell, Cliff; MDPI; Kim, Jeong-Ah; Jones, Linda K.; Terry, Daniel; Connell, Cliff; Kim, Jeong-Ah; Connell, Clifford; Jones, Linda; Jones, Linda K; Connell, Clifford; Kim, Jeong-ah; Kim, Jeong ah; Terry, Daniel",2023,HEALTHCARE,10.3390/healthcare11243112,WOS:001137792500001,Australia,"A web-based clinical simulation program, known as FIRST(2)ACT (Feedback Incorporating Review and Simulation Techniques to Act on Clinical Trends), was designed to increase the efficacy of clinicians' actions in the recognition and immediate response to a patient's deterioration. This study, which was nested in a larger mixed method project, used ten focus groups (n = 65) of graduate, enrolled, registered nurses, associate nurse unit managers, and general managers/educators/coordinators from four different institutions to investigate whether nurses felt their practice was influenced by participating in either a face-to-face or web-based simulation educational programme about patient deterioration. The results indicate that individuals who were less ""tech-savvy"" appreciated the flexibility of web-based learning, which increased their confidence. Face-to-face students appreciated self-reflection through performance evaluation. While face-to-face simulations were unable to completely duplicate symptoms, they showed nurses' adaptability. Both interventions enhanced clinical practice by improving documentation and replies while also boosting confidence and competence. Web learners initially experienced tech-related anxiety, which gradually subsided, demonstrating healthcare professionals' resilience to new learning approaches. Overall, the study highlighted the advantages and challenges of web-based and face-to-face education in clinical practice, emphasising the importance of adaptability and reflective learning for healthcare professionals. Further exploration of specific topics is required to improve practice, encourage knowledge sharing among colleagues, and improve early detection of patient deterioration.",0,0,clinical simulation; web-based intervention; face-to-face intervention; patient deterioration; patient safety; nurses; FIRST(2)ACT; DECISION-MAKING; SIMULATION; PERCEPTIONS; JUDGMENT; ONLINE; IMPACT; SKILLS; MODEL,Article,0
Sentimental analysis of Facebook reviews: Does hospitality matter in senior living?,"Zhong, YunYing (Susan); Zhang, TingTing; Ronzoni, Giulio; ELSEVIER SCI LTD; Zhong, YunYing (Susan); Zhang, TingTing; Ronzoni, Giulio; Zhong, YunYing (Susan); Zhang, Tingting",2023,INTERNATIONAL JOURNAL OF HOSPITALITY MANAGEMENT,10.1016/j.ijhm.2022.103384,WOS:001023531800001,USA,"The U.S. senior living industry is increasingly innovating through bridging hospitality and healthcare practices. This study aimed to examine the role of hospitality in the senior living setting from the consumer's perspectives, focusing on residents and their family and friends. Using text mining and sentiment analysis on Facebook reviews, the study uncovered five factors that affected satisfaction, dissatisfaction, and recommendation behavior: service delivery, built environment, social environment, hospitality amenities, and cost. Results indicated the relevance of hospitality, its specific meanings, and its effects on different resident-based outcomes in senior living. This research represents one of the few studies that attempt to broaden the applicability of hospitality to other service sectors and promote interdisciplinary research between senior living and hospitality.",0,0,Hospitality definition; Senior living; Facebook review; Sentiment analysis; Text mining; Recommendation; Satisfaction; Dissatisfaction; BIG DATA; SERVICE; CARE; SATISFACTION; PERCEPTIONS; CUSTOMERS; INDUSTRY; QUALITY; IMPACT; SCALE,Article,1
Impact of Surgical Residency Integration on Trauma and Acute Care Surgery Outcomes: A Retrospective Analysis,"Louis, Mena; Gibson, Brian; Krause, Morgan; ELSEVIER SCIENCE INC; Louis, Mena; Gibson, Brian; Krause, Morgan; Krause, Morgan; Louis, Mena; Krause, Morgan",2024,JOURNAL OF SURGICAL EDUCATION,10.1016/j.jsurg.2024.06.009,WOS:001291802700001,USA,"BACKGROUND: In the context of surgical education reform, the integration of residency programs represents a significant milestone. Concerns about potential disruptions to patient care metrics amid these changes necessitate empirical investigation. METHODS: This study assessed the impact of integrating surgical residency programs on patient outcomes within Trauma and Acute Care Surgery services. Pre- and postintegration data were meticulously analyzed to evaluate key metrics, including length of hospital stay, recovery rates, and complication rates. RESULTS: Contrary to initial concerns, the introduction of residency programs did not yield significant alterations in patient care metrics. Analysis revealed consistent outcomes pre- and post-integration, indicating the resilience of patient care amidst educational reforms. Despite the introduction of a high-stakes training environment, patient outcomes remained stable. CONCLUSION: The study highlights the compatibility educational advancements with the preservation of optimal patient care standards in Trauma and Acute Care Surgery services. Demonstrating the stability of patient care metrics in the face of educational reforms offers valuable insights for healthcare institutions considering similar initiatives. Overall, these findings contribute to the discourse on the value of surgical residency programs, reinforcing the importance of maintaining high-quality patient care standards while advancing surgical education. ( Association Directors in Published Elsevier Inc. All rights are reserved, including those for text and data mining, AI training, and similar technologies.)",0,0,acute care surgery; patient outcomes; recovery rates; complication rates; Surgical residency integration; trauma,Article,1
Predictors of the quality of life in siblings of children with chronic diseases,"Eidi, Fatemeh; Taklimi, Mahshid Mirzaie; Taheri-Ezbarami, Zahra; Faraji-Nesfechi, Elnaz; Leili, Ehsan Kazemnejad; ELSEVIER SCIENCE INC; Eidi, Fatemeh; Taklimi, Mahshid Mirzaie; Taheri-Ezbarami, Zahra; Faraji-Nesfechi, Elnaz; Leili, Ehsan Kazemnejad; Taklimi, Mahshid Mirzaie; ezbrami, zahra",2024,JOURNAL OF PEDIATRIC NURSING-NURSING CARE OF CHILDREN & FAMILIES,10.1016/j.pedn.2024.08.012,WOS:001370506100001,Iran,"Purpose: Advances in medical sciences have contributed to the increase in children living with chronic diseases. The diagnosis of a chronic disease in a child can affect the quality of life of all family members, including siblings. Therefore, this study aimed to identify the predictors of quality of life among siblings aged 8 to 12 years who have a brother or sister with chronic diseases. Methods: In this case-control study conducted in Rasht, 85 siblings of children with chronic diseases as the case group and 172 siblings of healthy children as the control group were recruited using cluster sampling. The two groups were matched for age and gender. Data were collected using the Pediatric Quality of Life Inventory (PedsQL TM) and a demographic questionnaire. The collected data were analyzed using Mann-Whitney U, Kruskal-Wallis, and logistic regression analysis tests via SPSS version 16. Results: The mean quality of life scores in the case and control groups were 88.86 +/- 10.33 and 87.39 +/- 10.89, respectively, indicating a desirable level within both groups. No statistically significant difference was found in this regard between the two groups. Based on the logistic regression analysis, three variables of number of family members (P = 0.03), mother's education level (P = 0.025), and family's income level (P = 0.023) were identified as significant predictors of quality of life. In this regard, it was found that the number of family members and the mother's education level were positively related to the quality of life, increasing the mean scores by 2.32 and 1.48, respectively. Conversely, a higher family income level was associated with a decrease in quality of life scores by 0.543. Conclusions: The study found that the quality of life among siblings of children with chronic diseases is good, comparable to that of their peers. The findings imply that the chronicity of the disease does not significantly impair siblings' adaptation and overall well-being. Practice implications: The findings of this study can be used in various fields, including healthcare management, nursing clinical services, nursing education, and nursing research. (c) 2024 Elsevier Inc. All rights are reserved, including those for text and data mining, AI training, and similar technologies.",0,0,Quality of life; Siblings; Chronic disease; Child; CHRONIC ILLNESS; PSYCHOLOGICAL ADJUSTMENT,Article,1
Secure Secondary Use of Clinical Data with Cloud-based NLP Services Towards a Highly Scalable Research Infrastructure,"Christoph, J.; Griebel, L.; Leb, I.; Engel, I.; Koepcke, F.; Toddenroth, D.; Prokosch, H. -U.; Laufer, J.; Marquardt, K.; Sedlmayr, M.; GEORG THIEME VERLAG KG; Christoph, J.; Griebel, L.; Leb, I.; Engel, I.; Koepcke, F.; Toddenroth, D.; Prokosch, H. -U.; Sedlmayr, M.; Laufer, J.; Marquardt, K.; Sedlmayr, M.; Sedlmayr, Martin; Sedlmayr, Martin",2015,METHODS OF INFORMATION IN MEDICINE,10.3414/ME13-01-0133,WOS:000355057800013,Germany,"Objectives: The secondary use of clinical data provides large opportunities for clinical and translational research as well as quality assurance projects. For such purposes, it is necessary to provide a flexible and scalable infrastructure that is compliant with privacy requirements. The major goals of the cloud4health project are to define such an architecture, to implement a technical prototype that fulfills these requirements and to evaluate it with three use cases.",0,0,Cloud-computing; secondary use; text-mining; privacy; natural language processing; software design; ELECTRONIC HEALTH RECORDS; INFORMATICS; NETWORK; LOINC,Article,2
"Impact of a pharmacist-driven COPD clinic on outcomes related to COPD in a federally qualified health center (Reprinted from J Am Pharm Assoc, vol 64, pg 512-516, 2024)","Glover, Lacey H.; Skelley, Jessica W.; Cimino, Lauren H.; Berry, Russell B.; ELSEVIER; Glover, Lacey H.; Glover, Lacey H.; Skelley, Jessica W.; Glover, Lacey H.; Skelley, Jessica W.; Skelley, Jessica W.; Cimino, Lauren H.; Berry, Russell B.; Berry, Russell B.; Glover, Lacey H.; Glover, Lacey",2024,JOURNAL OF THE AMERICAN PHARMACISTS ASSOCIATION,10.1016/j.japh.2024.102170,WOS:001325619900026,USA,"Background: Chronic obstructive pulmonary disease (COPD) affects many patients across the United States. Morbidity related to COPD can lead to increased financial strain to health care system. The United States is also shifting toward value-based payments, which rely on satisfying quality measures. Pharmacists are equipped with knowledge in adjusting medications based on symptom burden and guideline recommendations in COPD and are equipped with the proper knowledge to address quality measures.",0,0,,Article,0
