title,authors,year,journal,doi,uid,countries,abstract,citations,references,keywords,subtypeDescription
The role of surgeons during the COVID-19 pandemic: impact on training and lessons learned from a surgical resident's perspective,"Wady, Heitham; Restle, David; Park, Juyeon; Pryor, Aurora; Talamini, Mark; Abdel-Misih, Sherif; SPRINGER; Wady, Heitham; Restle, David; Park, Juyeon; Talamini, Mark; Pryor, Aurora; Abdel-Misih, Sherif; Wady, Heitham; Park, Juyeon; Restle, David",2021,SURGICAL ENDOSCOPY AND OTHER INTERVENTIONAL TECHNIQUES,10.1007/s00464-020-07790-3,WOS:000548483400001,USA,"Background Surgeons are trained as ""internists that also operate,"" bringing an important skillset to patient management during the current COVID-19 pandemic. A review was performed to illustrate the response of surgical staff during the pandemic with regard to patient care and residency training. Methods The evaluation and assessment of the changes enacted at Stony Brook Medicine's Department of Surgery is illustrated through the unique perspective of surgical residents. No IRB approval or written consent was obtained nor it was necessary for the purposes of this paper. Results Hospital policy was enacted to hinder transmission of COVID-19 and included limited gatherings of people, restricted travel, quarantined symptomatic staff, and careful surveillance for disease incidence. Surgical residency transformed as residents were diverted from traditional surgical services to staff new COVID-19 ICUs. Education transitioned to an online-based platform for lectures and reviews. New skills sets were acquired such as PICC line placement and complex ventilator management. Conclusions The viral surge impacted surgical training while also providing unique lessons regarding preparedness and strategic planning for future pandemic and disaster management.",0,0,COVID 19; Pandemic; Surgeons role; Health policy; CORONAVIRUS,Article
An interactive website for informed contraception choice: randomised evaluation of <i>Contraception Choices</i>,"Stephenson, Judith; Bailey, Julia, V; Gubijev, Ana; D'Souza, Preethy; Oliver, Sandy; Blandford, Ann; Hunter, Rachael; Shawe, Jill; Rait, Greta; Brima, Nataliya; Copas, Andrew; SAGE PUBLICATIONS LTD; Stephenson, Judith; Gubijev, Ana; Bailey, Julia, V; D'Souza, Preethy; Oliver, Sandy; Oliver, Sandy; Blandford, Ann; Hunter, Rachael; Rait, Greta; Shawe, Jill; Brima, Nataliya; Copas, Andrew; Stephenson, Judith; Brima, Nataliya; Rait, Greta; Hunter, Rachael; Bailey, Julia V; Oliver, Sandy; D'Souza, Preethy; Blandford, Ann; Blandford, Ann; SHAWE, JILL; Shawe, Jill; Stephenson, Judith; Copas, Andrew; Hunter, Rachael; Stephenson, Judith",2020,DIGITAL HEALTH,10.1177/2055207620936435,WOS:000545597700001,England; South Africa,"Objective: Improving use of effective contraception to prevent unintended pregnancy is a global priority, but misperceptions and concerns about contraception are common. Our objective was to evaluate an interactive website to aid informed choice of contraception.",0,0,Contraception; contraceptive methods; interactive digital intervention; digital health; randomised controlled trial; COMPUTER-ASSISTED PROVISION; PREGNANCY; BEHAVIOR; WOMEN,Article
Feasibility and acceptability of a telerehabilitation intervention on patients undergoing total knee arthroplasty in Iran: randomised controlled trial protocol,"Farrokhi, Navvab; Sarzaeem, Mohammad Mahdi; Feizi, Davood; BMJ PUBLISHING GROUP; Farrokhi, Navvab; Sarzaeem, Mohammad Mahdi; Feizi, Davood; Feizi, Davood; Farrokhi, Navvab; Sarzaeem, Mohammad Mahdi; Sarzaeem, Mohammad",2024,BMJ OPEN,10.1136/bmjopen-2023-083784,WOS:001250536100032,Iran,"Introduction Telerehabilitation is a promising avenue to enhance post-total knee arthroplasty (TKA) rehabilitation by improving accessibility, convenience and cost-effectiveness. Despite its potential benefits, its application in the context of TKA in Iran is in its early stages, lacking comprehensive studies on feasibility, acceptance and programme adherence. This article outlines a protocol for an open-label, parallel-group, randomised controlled trial investigating the impact of a 4 week telerehabilitation programme alongside usual care. Methods Thirty patients (aged 50-90) undergoing TKA for severe Knee Osteoarthritis at Atiyeh Hospital in Tehran, Iran, will be recruited using block randomisation. Participants will be assigned to either the intervention group, receiving telerehabilitation or the control group without telerehabilitation. The intervention will include virtual physiotherapy sessions thrice weekly, lasting 30-45 min each, over 4 weeks. The primary objective is to assess the feasibility and acceptability of telerehabilitation, measured through recruitment and attrition rates, questionnaire completion rates, patient satisfaction using appropriate questionnaire and adherence to the intervention. Secondary outcomes encompass four Knee Injury and Osteoarthritis Outcome Score questionnaire subscales (function in Activities of Daily Living, Pain, Symptoms, Quality of Life). Patient global assessment will use a standardised question. An online survey will evaluate walking assistant device usage, exercise adherence and adverse events. The number of individuals receiving in-person rehabilitation will be documented after the first postoperative surgeon visit. Assessments occur at baseline and 4 weeks postsurgery. Analysis Statistical analysis, including independent samples t-test, paired samples t-test, chi 2 test, Fisher's exact test, analysis of covariance and multiple linear regression, will use SPSS software version 16, with significance set at p<0.05. Ethics and dissemination Approved by AJA University of Medical Sciences Ethics Committee (IR.AJAUMS.REC.1402.126), trial results will be presented to relevant groups and published in peer-reviewed journals.",0,0,feasibility studies; knee; telemedicine; REHABILITATION; RECOMMENDATIONS; OUTCOMES; DESIGN,Article
Experiences of breast cancer survivors with exercise rehabilitation: qualitative systematic review and meta-synthesis,"Lu, Yanjuan; Liu, Chunlei; Sun, Mengying; He, Xiaoge; Wang, Wei; Lu, Qian; SPRINGER; Lu, Yanjuan; Liu, Chunlei; Sun, Mengying; He, Xiaoge; Wang, Wei; Lu, Qian; Liu, Chunlei; Lu, Qian; Liu, Chunlei; Lu, Qian",2023,SUPPORTIVE CARE IN CANCER,10.1007/s00520-023-08029-2,WOS:001061605100002,Peoples R China,"PurposeThis study aimed to synthesize and evaluate the available qualitative literature on posttreatment participation in exercise rehabilitation among breast cancer survivors.MethodsThis systematic review followed the Joanna Briggs Institute (JBI) meta-aggregation approach guided by ENTREQ, graded according to the ConQual approach, and evaluated using the JBI Qualitative Assessment and Review Instrument (JBI-QARI). We searched qualitative or mixed methods studies related to the experiences of exercise rehabilitation among breast cancer survivors conducted until April 13, 2023, in nine English and Chinese databases. The selected studies were reviewed independently, and the data were collaboratively synthesized into core themes.ResultsA total of 24 studies were included, and 88 findings resulted in five synthesis findings: (a) benefits of participating in exercise rehabilitation, (b) facilitators of participation in exercise rehabilitation, (c) obstacle factors for participating in exercise rehabilitation, (d) evaluation of the exercise program, and (e) recommendations.ConclusionBreast cancer survivors need exercise to recover physically and mentally and to transition from cancer treatment to a normal life. The factors affecting exercise participation in breast cancer survivors are complex. Breast cancer survivors require timely and continuous effective exercise intervention forms, including online, offline, instrumental, and emotional support from others, especially healthcare providers and family members. Moreover, multidisciplinary collaboration is required to develop more effective and convenient exercise interventions.",0,0,Breast cancer survivors; Exercise rehabilitation; Qualitative studies; Meta-synthesis; PHYSICAL-ACTIVITY PROGRAM; WEIGHT-LOSS; WOMEN; DIAGNOSIS; BARRIERS; PERSPECTIVES; FACILITATORS; HEALTH; LIFE; PARTICIPATION,Review
Doctor Recommendation Based on an Intuitionistic Normal Cloud Model Considering Patient Preferences,"Yang, Yan; Hu, Junhua; Liu, Yongmei; Chen, Xiaohong; SPRINGER; Yang, Yan; Hu, Junhua; Liu, Yongmei; Chen, Xiaohong; Hu, Junhua; liu, yongmei",2020,COGNITIVE COMPUTATION,10.1007/s12559-018-9616-3,WOS:000534884300011,Peoples R China,"Chinese medical websites help patients search for satisfactory doctors via the Internet regardless of time and location. Existing website systems recommend the same doctors for all patients using a global ranking but disregard patient preferences and online reviews. Additionally, these models do not consider the effects of interdependencies among criteria when making recommendations. We propose a systematic decision support model to improve such recommendations using intuitionistic fuzzy sets (IFSs) with the Bonferroni mean (BM) to address interdependencies. Our system accommodates patient preferences using multiple intuitionistic normal clouds (INCs). A case study using production data from , the largest such website, shows that our model improves the diversity and coverage of doctor recommendations while considering patient preferences when compared to the existing approach. This pattern continued with testing using data from several other Chinese healthcare sites. Our proposal is thus both applicable and readily implemented to improve the recommendations of these websites.",0,0,Decision support model; Intuitionistic normal cloud model; Medical websites; Doctor recommendation; GROUP DECISION-MAKING; PICTURE FUZZY-SETS; SIMILARITY MEASURES; AGGREGATION OPERATORS; DIVERSITY,Article
Virtual wobble spaces: A pilot study of the outcomes of online therapeutic spaces on practitioner well-being and social work practice,"Turner, Denise; Linton, Andrew; OXFORD UNIV PRESS; Turner, Denise; Linton, Andrew; Turner, Denise; Turner, Denise; Turner, Denise; Turner, Denise",2023,BRITISH JOURNAL OF SOCIAL WORK,10.1093/bjsw/bcac226,WOS:000895785900001,England,"Wobble rooms are physical spaces, often within hospitals and health care settings where staff can go to have a 'wobble.' They were set up largely as a response to the Covid-19 pandemic, and are therefore different in style and content, with some wobble rooms containing basics, whilst others host therapy animals and creative activities. Some wobble spaces were also established online. Evaluations of existing wobble spaces show that accessing a dedicated space, activities and sharing with others have positive effects on staff well-being. Despite this, the wobble space model does not appear to have been extended from health care into social work. This article describes a small pilot research study, delivered over three months, at fortnightly intervals, with social workers from the same UK authority. The study drew inspiration from the 'Weeble' a 1970's toy which could 'wobble but not fall down' and offered participants a safe place to meet, share and experiment with creative activities. Evaluations from the study show that participants experienced positive effects on both individual well-being and wider practice and suggest that there is scope for the model to be extended in social work more widely, alongside support methods such as coaching or counselling.",0,0,creativity; group supervision; stress; therapeutic; well-being; wobble space; BURNOUT; STRESS,Article
